ifconfig -a  查看所有网卡

tcpdump tcp -i 网卡名 port 7451
检查指定端口
tcpdump tcp port 7451
[root@ser6-75 ~]# tcpdump tcp port 7451
tcpdump: verbose output suppressed, use -v or -vv for full protocol decode
listening on eth0, link-type EN10MB (Ethernet), capture size 96 bytes
07:09:54.245065 IP 192.168.66.144.itose > 192.168.66.75.7451: S 3830269194:3830269194(0) win 8192 <mss 1460,nop,nop,sackOK>
07:09:54.295284 IP 192.168.66.75.7451 > 192.168.66.144.itose: S 3827807001:3827807001(0) ack 3830269195 win 5840 <mss 1460,nop,nop,sackOK>
07:09:54.245631 IP 192.168.66.144.itose > 192.168.66.75.7451: . ack 1 win 64240
07:09:54.245681 IP 192.168.66.75.7451 > 192.168.66.144.itose: P 1:45(44) ack 1 win 5840
07:09:54.254972 IP 192.168.66.144.itose > 192.168.66.75.7451: R 1:1(0) ack 45 win 0
07:09:54.255924 IP 192.168.66.144.fsportmap > 192.168.66.75.7451: S 2978091218:2978091218(0) win 8192 <mss 1460,nop,nop,sackOK>
07:09:54.255930 IP 192.168.66.75.7451 > 192.168.66.144.fsportmap: S 3829512179:3829512179(0) ack 2978091219 win 5840 <mss 1460,nop,nop,sackOK>
07:09:54.256197 IP 192.168.66.144.fsportmap > 192.168.66.75.7451: . ack 1 win 64240
07:09:54.256226 IP 192.168.66.75.7451 > 192.168.66.144.fsportmap: P 1:45(44) ack 1 win 5840
07:09:54.345747 IP 192.168.66.144.fsportmap > 192.168.66.75.7451: P 1:172(171) ack 45 win 64196
07:09:54.345816 IP 192.168.66.75.7451 > 192.168.66.144.fsportmap: . ack 172 win 6432
07:09:54.347456 IP 192.168.66.75.7451 > 192.168.66.144.fsportmap: P 45:196(151) ack 172 win 6432
07:09:54.545926 IP 192.168.66.144.fsportmap > 192.168.66.75.7451: . ack 196 win 64045
07:10:24.542393 IP 192.168.66.75.7451 > 192.168.66.144.fsportmap: . ack 172 win 6432
07:10:24.542994 IP 192.168.66.144.fsportmap > 192.168.66.75.7451: . ack 196 win 64045
07:10:54.539368 IP 192.168.66.75.7451 > 192.168.66.144.fsportmap: . ack 172 win 6432
07:10:54.539958 IP 192.168.66.144.fsportmap > 192.168.66.75.7451: . ack 196 win 64045

